{
  "$schema": "../schema/access-model-schema.json",
  "version": "1.0.0",
  "metadata": {
    "title": "Procurement-Agents blueprint family -- illustrative example",
    "description": "A worked, fully fictitious example of the Phase 1 canonical access model: one blueprint with two downstream agent identities exhibiting privilege drift (one actively exploited, one latent/unused), one with an incomplete resource-specific grant, one with a well-scoped new-resource-app permission, and a second blueprint sharing the same tenant-wide drift permission to make the blast-radius simulation in Phase 2 realistic. It also deliberately demonstrates that Microsoft Graph's Files.Read.All has no per-resource scoping equivalent to Sites.Selected: every agent that inherits it genuinely reaches Executive OneDrive too, which is a real, evaluator-surfaced finding rather than a cosmetic one. A separate vector-index resource with no mapped permission at all is included to show what a truly unreachable-but-adjacent resource looks like. No real tenant, GUIDs, or users are represented.",
    "tenantRef": "example-only-not-a-real-tenant",
    "generatedAt": "2026-09-29T08:00:00Z",
    "telemetryCoveragePercent": 100,
    "deploymentStatus": "draft",
    "statusReason": "Illustrative sample content for the Agent Effective Access & Blast Radius workbook, not a real investigation."
  },
  "blueprints": [
    {
      "id": "procurement-agents-blueprint",
      "displayName": "Procurement-Agents",
      "appId": "00000000-0000-4000-8000-000000000001",
      "signInAudience": "AzureADMyOrg",
      "baselinePermissions": [
        { "resourceApp": "Microsoft Graph", "permission": "Sites.Read.All", "permissionType": "delegated", "inheritancePattern": "enumeratedScopes" },
        { "resourceApp": "Microsoft Graph", "permission": "Files.Read.All", "permissionType": "delegated", "inheritancePattern": "enumeratedScopes" },
        { "resourceApp": "Microsoft Graph", "permission": "Mail.Read", "permissionType": "delegated", "inheritancePattern": "allAllowedScopes" }
      ],
      "observation": {
        "source": "Entra Agent ID Graph snapshot (example only)",
        "sourceTable": "GET /applications/{id} (agentIdentityBlueprint.inheritablePermissions)",
        "asOf": "2026-09-29T00:00:00Z",
        "confidence": "high",
        "note": "Fictitious blueprint for illustration. Mail.Read uses the 'allAllowedScopes' inheritance pattern, so any future delegated Exchange scope granted to the blueprint -- not just Mail.Read -- will flow to every downstream agent identity without further review."
      }
    },
    {
      "id": "finance-agents-blueprint",
      "displayName": "Finance-Reconciliation-Agents",
      "appId": "00000000-0000-4000-8000-000000000002",
      "signInAudience": "AzureADMyOrg",
      "baselinePermissions": [
        { "resourceApp": "Microsoft Graph", "permission": "Files.Read.All", "permissionType": "delegated", "inheritancePattern": "enumeratedScopes" }
      ],
      "observation": {
        "source": "Entra Agent ID Graph snapshot (example only)",
        "sourceTable": "GET /applications/{id} (agentIdentityBlueprint.inheritablePermissions)",
        "asOf": "2026-09-29T00:00:00Z",
        "confidence": "high"
      }
    }
  ],
  "agentIdentities": [
    {
      "id": "procurement-agent-prod",
      "displayName": "Procurement-Agent-Prod",
      "blueprintId": "procurement-agents-blueprint",
      "servicePrincipalId": "00000000-0000-4000-8000-000000000011",
      "owner": "procurement-it@example.com",
      "sponsor": "jane.doe@example.com",
      "status": "active",
      "createdAt": "2026-01-15T00:00:00Z",
      "observation": { "source": "Entra Agent ID Graph snapshot (example only)", "sourceTable": "/servicePrincipals/microsoft.graph.agentIdentity", "asOf": "2026-09-29T00:00:00Z", "confidence": "high" }
    },
    {
      "id": "procurement-agent-dev",
      "displayName": "Procurement-Agent-Dev",
      "blueprintId": "procurement-agents-blueprint",
      "servicePrincipalId": "00000000-0000-4000-8000-000000000012",
      "owner": "procurement-it@example.com",
      "sponsor": "jane.doe@example.com",
      "status": "active",
      "createdAt": "2026-03-01T00:00:00Z",
      "observation": { "source": "Entra Agent ID Graph snapshot (example only)", "sourceTable": "/servicePrincipals/microsoft.graph.agentIdentity", "asOf": "2026-09-29T00:00:00Z", "confidence": "high", "note": "Control case: inherits only the blueprint baseline, no direct grants." }
    },
    {
      "id": "procurement-agent-eu",
      "displayName": "Procurement-Agent-EU",
      "blueprintId": "procurement-agents-blueprint",
      "servicePrincipalId": "00000000-0000-4000-8000-000000000013",
      "owner": "procurement-it-eu@example.com",
      "sponsor": "marco.rossi@example.com",
      "status": "active",
      "createdAt": "2026-04-10T00:00:00Z",
      "observation": { "source": "Entra Agent ID Graph snapshot (example only)", "sourceTable": "/servicePrincipals/microsoft.graph.agentIdentity", "asOf": "2026-09-29T00:00:00Z", "confidence": "high" }
    },
    {
      "id": "procurement-agent-reporting",
      "displayName": "Procurement-Agent-Reporting",
      "blueprintId": "procurement-agents-blueprint",
      "servicePrincipalId": "00000000-0000-4000-8000-000000000014",
      "owner": "procurement-it@example.com",
      "sponsor": "jane.doe@example.com",
      "status": "active",
      "createdAt": "2026-05-20T00:00:00Z",
      "observation": { "source": "Entra Agent ID Graph snapshot (example only)", "sourceTable": "/servicePrincipals/microsoft.graph.agentIdentity", "asOf": "2026-09-29T00:00:00Z", "confidence": "high" }
    },
    {
      "id": "finance-agent-prod",
      "displayName": "Finance-Reconciliation-Agent-Prod",
      "blueprintId": "finance-agents-blueprint",
      "servicePrincipalId": "00000000-0000-4000-8000-000000000021",
      "owner": "finance-it@example.com",
      "sponsor": "amir.khan@example.com",
      "status": "active",
      "createdAt": "2026-02-01T00:00:00Z",
      "observation": { "source": "Entra Agent ID Graph snapshot (example only)", "sourceTable": "/servicePrincipals/microsoft.graph.agentIdentity", "asOf": "2026-09-29T00:00:00Z", "confidence": "high", "note": "Control case: inherits only the blueprint baseline." }
    },
    {
      "id": "finance-agent-legacy",
      "displayName": "Finance-Reconciliation-Agent-Legacy",
      "blueprintId": "finance-agents-blueprint",
      "servicePrincipalId": "00000000-0000-4000-8000-000000000022",
      "owner": "finance-it@example.com",
      "sponsor": "amir.khan@example.com",
      "status": "active",
      "createdAt": "2025-11-01T00:00:00Z",
      "observation": { "source": "Entra Agent ID Graph snapshot (example only)", "sourceTable": "/servicePrincipals/microsoft.graph.agentIdentity", "asOf": "2026-09-29T00:00:00Z", "confidence": "high", "note": "Predates current governance review; carries a legacy direct grant." }
    }
  ],
  "credentials": [
    {
      "id": "cred-procurement-blueprint-fic",
      "blueprintId": "procurement-agents-blueprint",
      "type": "federatedIdentityCredential",
      "issuer": "https://login.microsoftonline.com/00000000-0000-4000-8000-000000000000/v2.0",
      "subject": "api://AzureADTokenExchange",
      "lastRotatedAt": "2026-07-01T00:00:00Z",
      "lastUsedAt": "2026-09-29T07:55:00Z",
      "observation": { "source": "example only", "confidence": "medium", "note": "Managed Identity + Workload Identity Federation is the production credential path; this record is illustrative." }
    },
    {
      "id": "cred-finance-blueprint-fic",
      "blueprintId": "finance-agents-blueprint",
      "type": "federatedIdentityCredential",
      "issuer": "https://login.microsoftonline.com/00000000-0000-4000-8000-000000000000/v2.0",
      "subject": "api://AzureADTokenExchange",
      "lastRotatedAt": "2026-06-15T00:00:00Z",
      "lastUsedAt": "2026-09-29T07:40:00Z",
      "observation": { "source": "example only", "confidence": "medium" }
    }
  ],
  "entitlements": [
    { "id": "ent-prod-inh-sites-read", "agentIdentityId": "procurement-agent-prod", "resourceApp": "Microsoft Graph", "permission": "Sites.Read.All", "permissionType": "delegated", "grantType": "inherited", "executionContext": "delegatedObo", "consentState": "materialized", "sourceId": "procurement-agents-blueprint", "grantedAt": "2026-01-15T00:05:00Z", "observation": { "source": "example only", "sourceTable": "/servicePrincipals/{id}/oauth2PermissionGrants", "asOf": "2026-09-29T00:00:00Z", "confidence": "high" } },
    { "id": "ent-prod-inh-files-read", "agentIdentityId": "procurement-agent-prod", "resourceApp": "Microsoft Graph", "permission": "Files.Read.All", "permissionType": "delegated", "grantType": "inherited", "executionContext": "delegatedObo", "consentState": "materialized", "sourceId": "procurement-agents-blueprint", "grantedAt": "2026-01-15T00:05:00Z", "observation": { "source": "example only", "sourceTable": "/servicePrincipals/{id}/oauth2PermissionGrants", "asOf": "2026-09-29T00:00:00Z", "confidence": "high" } },
    { "id": "ent-prod-inh-mail-read", "agentIdentityId": "procurement-agent-prod", "resourceApp": "Microsoft Graph", "permission": "Mail.Read", "permissionType": "delegated", "grantType": "inherited", "executionContext": "delegatedObo", "consentState": "materialized", "sourceId": "procurement-agents-blueprint", "grantedAt": "2026-01-15T00:05:00Z", "observation": { "source": "example only", "sourceTable": "/servicePrincipals/{id}/oauth2PermissionGrants", "asOf": "2026-09-29T00:00:00Z", "confidence": "high" } },